id,task,downloads,likes,tags,description
tiantiaf/wavlm-large-voice-quality,audio-classification,963,3,"safetensors, model_hub_mixin, pytorch_model_hub_mixin, audio-classification, en, dataset:ajd12342/paraspeechcaps, arxiv:2505.14648, base_model:microsoft/wavlm-large",This model includes the implementation of voice quality classification described in Vox-Profile: A Speech Foundation Model Benchmark for Characterizing Diverse Speaker and Speech Traits (https://arxiv
chuhac/BiomedCLIP-vit-bert-hf,zero-shot-classification,7157,8,"transformers, pytorch, safetensors, clip, feature-extraction, zero-shot-classification, custom_code, en",1. pure torch and huggingface-based implementation of the original microsoft/BiomedCLIP-PubMedBERT_256-vit_base_patch16_224
tiantiaf/voxlect-mandarin-cantonese-dialect-mms-lid-256,audio-classification,24576,1,"transformers, safetensors, model_hub_mixin, pytorch_model_hub_mixin, speaker_dialect_classification, audio-classification, zh, dataset:mozilla-foundation/common_voice_11_0","This model includes the implementation of Mandarin dialect and Cantonese classification described in <a href=""https://arxiv.org/abs/2508.01691""><strong>**Voxlect: A Speech Foundation Model Benchmark f"
Aisha-AI-Official/wan2.2-rough-sex-doggy-style,image-text-to-video,0,6,"lora, nsfw, image-text-to-video, base_model:Wan-AI/Wan2.2-I2V-A14B-Diffusers, base_model:adapter:Wan-AI/Wan2.2-I2V-A14B-Diffusers, region:us","The scene start with a woman posing, then the scene cut to a side view in bedroom interior, one african black man and the same woman in a bed."
depth-anything/Depth-Anything-V2-Large,depth-estimation,98528,154,"depth-anything-v2, depth, relative depth, depth-estimation, en, arxiv:2406.09414, license:cc-by-nc-4.0, region:us","Depth Anything V2 is trained from 595K synthetic labeled images and 62M+ real unlabeled images, providing the most capable monocular depth estimation (MDE) model with the following features:"
guoyww/animatediff-motion-lora-tilt-up,text-to-video,1730,2,"diffusers, safetensors, animatediff, text-to-video, region:us",Motion LoRAs allow adding specific types of motion to your animations.
ditwoo/whisper-tiny-finetuned-gtzan,audio-classification,1568,0,"transformers, pytorch, safetensors, whisper, audio-classification, generated_from_trainer, dataset:marsyas/gtzan, base_model:openai/whisper-tiny","should probably proofread and complete it, then remove this comment. -->"
dell-research-harvard/lt-wikidata-comp-en,sentence-similarity,521948,2,"sentence-transformers, safetensors, mpnet, linktransformer, sentence-similarity, tabular-classification, en, arxiv:2309.00789",This is a [LinkTransformer](https://linktransformer.github.io/) model. At its core this model this is a sentence transformer model [sentence-transformers](https://www.SBERT.net) model- it just wraps a
unsloth/Qwen2.5-Omni-7B-GGUF,any-to-any,8905,64,"transformers, gguf, qwen2_5_omni, multimodal, unsloth, any-to-any, en, arxiv:2503.20215","Qwen2.5-Omni is an end-to-end multimodal model designed to perceive diverse modalities, including text, images, audio, and video, while simultaneously generating text and natural speech responses in a"
Ade26/tapas_test,table-question-answering,6,0,"transformers, safetensors, tapas, table-question-answering, endpoints_compatible, region:us",
MansfieldPlumbing/Demucs_v4_TRT,audio-to-audio,160,2,"tensorrt, onnx, audio, music-source-separation, demucs, htdemucs, stem-separation, windows","**HTDemucs 6-stem, exported to a single-graph ONNX checkpoint and compiled to TensorRT for native Windows inference.**"
MikhailKuz/tmp,document-question-answering,45,0,"transformers, tensorboard, safetensors, layoutlmv2, document-question-answering, generated_from_trainer, base_model:microsoft/layoutlmv2-base-uncased, base_model:finetune:microsoft/layoutlmv2-base-uncased","should probably proofread and complete it, then remove this comment. -->"
kem000123/autotrain-model1-binary-class-1843363194,tabular-classification,4,0,"transformers, joblib, autotrain, tabular, classification, tabular-classification, dataset:kem000123/autotrain-data-model1-binary-class, co2_eq_emissions",- Problem type: Binary Classification
paultltc/colmodernvbert_hf,visual-document-retrieval,345,0,"colpali, safetensors, vidore-experimental, vidore, visual-document-retrieval, en, arxiv:2510.01149, license:mit","This is the model card for `ColModernVBERT`, the late-interaction version of ModernVBERT that is fine-tuned for visual document retrieval tasks, our most performant model on this task."
apple/coreml-sam2.1-baseplus,mask-generation,41,3,"coreml, mask-generation, arxiv:2408.00714, license:apache-2.0, region:us","SAM 2 (Segment Anything in Images and Videos), is a collection of foundation models from FAIR that aim to solve promptable visual segmentation in images and videos. See the [SAM 2 paper](https://arxiv"
google/owlvit-large-patch14,zero-shot-object-detection,12700,29,"transformers, pytorch, owlvit, zero-shot-object-detection, vision, arxiv:2205.06230, license:apache-2.0, region:us",The OWL-ViT (short for Vision Transformer for Open-World Localization) was proposed in [Simple Open-Vocabulary Object Detection with Vision Transformers](https://arxiv.org/abs/2205.06230) by Matthias 
jayn7/WAN2.2-I2V_A14B-DISTILL-LIGHTX2V-4STEP-GGUF,image-to-video,10500,32,"gguf, image-to-video, video-generation, base_model:lightx2v/Wan2.2-Distill-Models, base_model:quantized:lightx2v/Wan2.2-Distill-Models, region:us",Quantized GGUF versions of the [Wan2.2 Distill Models](https://huggingface.co/lightx2v/Wan2.2-Distill-Models) by the LightX2V team.
typeform/mobilebert-uncased-mnli,zero-shot-classification,996,14,"transformers, pytorch, safetensors, mobilebert, text-classification, zero-shot-classification, en, dataset:multi_nli",This model is the Multi-Genre Natural Language Inference (MNLI) fine-turned version of the [uncased MobileBERT model](https://huggingface.co/google/mobilebert-uncased).
vectara/hallucination_evaluation_model,text-classification,79558,348,"transformers, safetensors, HHEMv2Config, text-classification, custom_code, en, arxiv:2205.12854, arxiv:2401.00396","👉 **[Launch Interactive Demo](https://huggingface.co/spaces/vectara/hhem-2.1-open-demo)** - No setup required, runs in your browser"
tencent/Hunyuan3D-2,image-to-3d,82666,1731,"hunyuan3d-2, diffusers, safetensors, image-to-3d, text-to-3d, en, zh, arxiv:2501.12202","[//]: # (  <a href=# target=""_blank""><img src=https://img.shields.io/badge/Report-b5212f.svg?logo=arxiv height=22px></a>)"
deepset/bert-base-cased-squad2,question-answering,50182,21,"transformers, pytorch, jax, safetensors, bert, question-answering, en, dataset:squad_v2",This is a BERT base cased model trained on SQuAD v2
AntonioTH/Layout-finetuned-fr-model-50instances20-100epochs-5e-05lr,document-question-answering,143,0,"transformers, tensorboard, safetensors, layoutlmv2, document-question-answering, generated_from_trainer, base_model:microsoft/layoutxlm-base, base_model:finetune:microsoft/layoutxlm-base","should probably proofread and complete it, then remove this comment. -->"
Qwen/Qwen2.5-32B-Instruct-AWQ,text-generation,1373513,98,"transformers, safetensors, qwen2, text-generation, chat, conversational, en, arxiv:2309.00071","Qwen2.5 is the latest series of Qwen large language models. For Qwen2.5, we release a number of base language models and instruction-tuned language models ranging from 0.5 to 72 billion parameters. Qw"
openai/whisper-small,automatic-speech-recognition,1968161,548,"transformers, pytorch, tf, jax, safetensors, whisper, automatic-speech-recognition, audio",Whisper is a pre-trained model for automatic speech recognition (ASR) and speech translation. Trained on 680k hours
OpenMed/OpenMed-NER-PathologyDetect-TinyMed-135M,token-classification,180493,0,"transformers, safetensors, distilbert, token-classification, named-entity-recognition, biomedical-nlp, disease-entity-recognition, medical-diagnosis",**Specialized model for Disease Entity Recognition - Disease entities from the NCBI dataset**
Jgarritz/ultravox-v0_5-llama-3_1-8b,audio-text-to-text,18,0,"transformers, safetensors, ultravox, feature-extraction, audio-text-to-text, custom_code, ar, be",Ultravox is a multimodal Speech LLM built around a pretrained [Llama3.1-8B-Instruct](https://huggingface.co/meta-llama/Meta-Llama-3.1-8B) and [whisper-large-v3-turbo](https://huggingface.co/openai/whi
nomic-ai/modernbert-embed-base,sentence-similarity,171362,228,"sentence-transformers, onnx, safetensors, modernbert, feature-extraction, sentence-similarity, mteb, transformers.js","ModernBERT Embed is an embedding model trained from [ModernBERT-base](https://huggingface.co/answerdotai/ModernBERT-base), bringing the new advances of ModernBERT to embeddings!"
city96/FLUX.1-dev-gguf,text-to-image,107359,1303,"gguf, text-to-image, image-generation, flux, base_model:black-forest-labs/FLUX.1-dev, base_model:quantized:black-forest-labs/FLUX.1-dev, license:other, region:us",This is a direct GGUF conversion of [black-forest-labs/FLUX.1-dev](https://huggingface.co/black-forest-labs/FLUX.1-dev/tree/main)
neuphonic/neucodec,audio-to-audio,92364,103,"pytorch, audio, speech, audio-to-audio, speech-language-models, dataset:amphion/Emilia-Dataset, dataset:facebook/multilingual_librispeech, dataset:CSTR-Edinburgh/vctk",*Click the image above to see NeuCodec in action on Youtube!*
akore/rtmw-m-256x192,keypoint-detection,88,0,"safetensors, rtmw, pose-estimation, wholebody-pose, rtmpose, keypoint-detection, computer-vision, custom_code",This is a Hugging Face-compatible port of **rtmw-m-256x192** from [OpenMMLab MMPose](https://github.com/open-mmlab/mmpose).
Helsinki-NLP/opus-mt-fi-en,translation,29814,4,"transformers, pytorch, tf, marian, text2text-generation, translation, fi, en",*  OPUS readme: [fin-eng](https://github.com/Helsinki-NLP/Tatoeba-Challenge/tree/master/models/fin-eng/README.md)
deepseek-ai/DeepSeek-OCR,image-text-to-text,2024891,3212,"transformers, safetensors, deepseek_vl_v2, feature-extraction, deepseek, vision-language, ocr, custom_code",Inference using Huggingface transformers on NVIDIA GPUs. Requirements tested on python 3.12.9 + CUDA11.8：
city96/Wan2.1-T2V-14B-gguf,text-to-video,26691,190,"gguf, text-to-video, base_model:Wan-AI/Wan2.1-T2V-14B, base_model:quantized:Wan-AI/Wan2.1-T2V-14B, license:apache-2.0, region:us",This is a direct GGUF conversion of [Wan-AI/Wan2.1-T2V-14B](https://huggingface.co/Wan-AI/Wan2.1-T2V-14B)
rathi2023/owlvit-base-patch32_FT_cppe5,zero-shot-object-detection,11,0,"transformers, tensorboard, safetensors, owlvit, zero-shot-object-detection, endpoints_compatible, region:us",
openbmb/MiniCPM-o-4_5-gguf,any-to-any,14214,120,"transformers, gguf, minicpm-o, minicpm-v, multimodal, full-duplex, any-to-any, arxiv:2408.01800","A Gemini 2.5 Flash Level MLLM for Vision, Speech, and Full-Duplex Mulitmodal Live Streaming on Your Phone"
RioJune/AG-KD,zero-shot-object-detection,7,0,"transformers, safetensors, florence2, image-text-to-text, zero-shot-object-detection, custom_code, arxiv:2508.04572, arxiv:2503.03278","**Knowledge to Sight (K2Sight)** is a novel framework designed for grounding abnormalities in medical images, where the goal is to localize clinical findings based on textual descriptions. Unlike gene"
Menoviar28/menov9,image-text-to-image,0,0,"art, image-text-to-image, aa, ae, license:openrail, region:us",
sentence-transformers/distiluse-base-multilingual-cased-v2,sentence-similarity,743504,208,"sentence-transformers, pytorch, tf, onnx, safetensors, openvino, distilbert, feature-extraction",This is a [sentence-transformers](https://www.SBERT.net) model: It maps sentences & paragraphs to a 512 dimensional dense vector space and can be used for tasks like clustering or semantic search.
nomic-ai/nomic-embed-text-v1.5,sentence-similarity,11498265,797,"sentence-transformers, onnx, safetensors, nomic_bert, feature-extraction, sentence-similarity, mteb, transformers",[Blog](https://www.nomic.ai/blog/posts/nomic-embed-text-v1) | [Technical Report](https://arxiv.org/abs/2402.01613) | [AWS SageMaker](https://aws.amazon.com/marketplace/seller-profile?id=seller-tpqidcj
jonatasgrosman/wav2vec2-large-xlsr-53-greek,automatic-speech-recognition,510874,3,"transformers, pytorch, jax, wav2vec2, automatic-speech-recognition, audio, speech, xlsr-fine-tuning-week",Fine-tuned [facebook/wav2vec2-large-xlsr-53](https://huggingface.co/facebook/wav2vec2-large-xlsr-53) on Greek using the train and validation splits of [Common Voice 6.1](https://huggingface.co/dataset
MakiAi/LTX-2.3-GGUF,image-to-video,22038,0,"ggml, gguf, image-to-video, unsloth, text-to-video, video-to-video, image-text-to-video, audio-to-video",This is a GGUF quantized version of [LTX-2.3](https://huggingface.co/Lightricks/LTX-2.3). <br>
timm/vit_tiny_patch16_224.augreg_in21k_ft_in1k,image-classification,280735,3,"timm, pytorch, safetensors, image-classification, transformers, dataset:imagenet-1k, dataset:imagenet-21k, arxiv:2106.10270","A Vision Transformer (ViT) image classification model. Trained on ImageNet-21k and fine-tuned on ImageNet-1k (with additional augmentation and regularization) in JAX by paper authors, ported to PyTorc"
QuantStack/Wan2.2-S2V-14B-GGUF,text-to-video,5268,74,"gguf, s2v, text-to-video, base_model:Wan-AI/Wan2.2-S2V-14B, base_model:quantized:Wan-AI/Wan2.2-S2V-14B, license:apache-2.0, region:us",This GGUF file is a direct conversion of [Wan-AI/Wan2.2-S2V-14B](https://huggingface.co/Wan-AI/Wan2.2-S2V-14B)
fxmarty/pix2struct-tiny-random,image-to-text,1874,2,"transformers, pytorch, pix2struct, image-text-to-text, image-to-text, license:mit, endpoints_compatible, region:us",
eenzeenee/t5-base-korean-summarization,summarization,3361,34,"transformers, pytorch, safetensors, t5, text2text-generation, T5, summarization, ko",This is [T5](https://huggingface.co/docs/transformers/model_doc/t5) model for korean text summarization.
cross-encoder/ms-marco-TinyBERT-L2,text-ranking,30503,21,"sentence-transformers, pytorch, jax, onnx, safetensors, openvino, bert, text-classification",This model was trained on the [MS Marco Passage Ranking](https://github.com/microsoft/MSMARCO-Passage-Ranking) task.
omarques/autotrain-in-class-test-demo-1659958764,tabular-classification,5,0,"transformers, joblib, autotrain, tabular, classification, tabular-classification, dataset:omarques/autotrain-data-in-class-test-demo, co2_eq_emissions",- Problem type: Binary Classification
OmniGen2/OmniGen2,any-to-any,31817,430,"diffusers, safetensors, any-to-any, arxiv:2506.18871, arxiv:2404.07724, license:apache-2.0, diffusers:OmniGen2Pipeline, region:us",- **2025-07-05**: Training datasets [X2I2](https://huggingface.co/datasets/OmniGen2/X2I2) are available.
ryukkt62/Suncast,tabular-regression,46,17,"sklearn, solar-energy, photovoltaic, forecasting, random-forest, pycaret, gfs, nasa-power","A machine learning model that predicts **hourly solar PV power generation (kWh)** for any location across mainland China, given latitude, longitude, and a date range."
facebook/dinov3-vits16plus-pretrain-lvd1689m,image-feature-extraction,28512,15,"transformers, safetensors, dinov3_vit, image-feature-extraction, dino, dinov3, arxiv:2508.10104, en",
am-infoweb/layoutlmv3-finetuned_docvqa,document-question-answering,28,3,"transformers, pytorch, safetensors, layoutlmv3, document-question-answering, generated_from_trainer, base_model:microsoft/layoutlmv3-base, base_model:finetune:microsoft/layoutlmv3-base","should probably proofread and complete it, then remove this comment. -->"
facebook/timesformer-hr-finetuned-k400,video-classification,205,3,"transformers, pytorch, timesformer, video-classification, vision, arxiv:2102.05095, license:cc-by-nc-4.0, endpoints_compatible",TimeSformer model pre-trained on [Kinetics-400](https://www.deepmind.com/open-source/kinetics). It was introduced in the paper [TimeSformer: Is Space-Time Attention All You Need for Video Understandin
cardiffnlp/twitter-xlm-roberta-base-sentiment,text-classification,963547,256,"transformers, pytorch, tf, xlm-roberta, text-classification, multilingual, arxiv:2104.12250, endpoints_compatible","This is a multilingual XLM-roBERTa-base model trained on ~198M tweets and finetuned for sentiment analysis. The sentiment fine-tuning was done on 8 languages (Ar, En, Fr, De, Hi, It, Sp, Pt) but it ca"
xingyang1/Distill-Any-Depth-Small-hf,depth-estimation,964,7,"transformers, safetensors, depth_anything, depth-estimation, distill-any-depth, vision, arxiv:2502.19204, license:mit","We present Distill-Any-Depth, a new SOTA monocular depth estimation model trained with our proposed knowledge distillation algorithms. It was introduced in the paper [Distill Any Depth: Distillation C"
ricoh-ai/Qwen-3-VL-Ricoh-8B-20260227,visual-question-answering,865,13,"safetensors, qwen3_vl, visual-question-answering, ja, base_model:Qwen/Qwen3-VL-8B-Thinking, base_model:finetune:Qwen/Qwen3-VL-8B-Thinking, license:apache-2.0, region:us",
microsoft/deberta-base-mnli,text-classification,60061,8,"transformers, pytorch, rust, deberta, text-classification, deberta-v1, deberta-mnli, en",[DeBERTa](https://arxiv.org/abs/2006.03654) improves the BERT and RoBERTa models using disentangled attention and enhanced mask decoder. It outperforms BERT and RoBERTa on  majority of NLU tasks with 
google/ddpm-celebahq-256,unconditional-image-generation,15077,55,"diffusers, pytorch, unconditional-image-generation, arxiv:2006.11239, license:apache-2.0, diffusers:DDPMPipeline, region:us",**Paper**: [Denoising Diffusion Probabilistic Models](https://arxiv.org/abs/2006.11239)
valiantcat/LTX-2.3-Transition-LORA,image-to-video,21969,80,"diffusers, lora, ValiantCat, Lightricks, LTX-2.3, image-to-video, en, base_model:Lightricks/LTX-2.3",This LoRA is trained on top of **[Lightricks/LTX-2.3](https://huggingface.co/Lightricks/LTX-2.3)** and is built with a custom training paradigm tailored for high-consistency video generation.
facebook/sapiens-pose-1b-bfloat16,keypoint-detection,33,1,"sapiens, keypoint-detection, en, arxiv:2408.12569, license:cc-by-nc-4.0, region:us","Sapiens is a family of vision transformers pretrained on 300 million human images at 1024 x 1024 image resolution. The pretrained models, when finetuned for human-centric vision tasks, generalize to i"
unsloth/FLUX.2-klein-9B-GGUF,image-to-image,65115,174,"ggml, gguf, image-generation, unsloth, image-editing, flux, diffusion-single-file, image-to-image",This is a GGUF quantized version of [FLUX.2-klein-9B](https://huggingface.co/black-forest-labs/FLUX.2-klein-9B). <br>
mradermacher/Vero-Qwen3I-8B-i1-GGUF,reinforcement-learning,4953,0,"transformers, gguf, vero, vision-language-model, multimodal, visual-reasoning, reinforcement-learning, en",weighted/imatrix quants of https://huggingface.co/zlab-princeton/Vero-Qwen3I-8B
jeannedup/a2c-cartpole,reinforcement-learning,283,0,"stable-baselines3, CartPole-v1, deep-reinforcement-learning, reinforcement-learning, model-index, region:us",This is a trained model of a **A2C** agent playing **CartPole-v1**
cacauvicosa/heart1ohr2x9e-target-classification,tabular-classification,0,0,"sklearn, tabular-classification, baseline-trainer, license:apache-2.0, region:us","Name: LogisticRegression(class_weight='balanced', max_iter=1000), dtype: float64"
HumanCompatibleAI/ppo-seals-CartPole-v0,reinforcement-learning,55733,16,"stable-baselines3, seals/CartPole-v0, deep-reinforcement-learning, reinforcement-learning, model-index, region:us",This is a trained model of a **PPO** agent playing **seals/CartPole-v0**
usyd-community/vitpose-plus-base,keypoint-detection,4870536,31,"transformers, safetensors, vitpose, keypoint-detection, en, arxiv:2204.12484, license:apache-2.0, endpoints_compatible",ViTPose: Simple Vision Transformer Baselines for Human Pose Estimation and ViTPose+: Vision Transformer Foundation Model for Generic Body Pose Estimation. It obtains 81.1 AP on MS COCO Keypoint test-d
Mungert/Holo1-3B-GGUF,visual-document-retrieval,445,1,"transformers, gguf, multimodal, action, agent, visual-document-retrieval, en, arxiv:2506.02865",This model is described in the paper [Surfer-H Meets Holo1: Cost-Efficient Web Agent Powered by Open Weights](https://huggingface.co/papers/2506.02865). The project page can be found at [https://www.s
AInVFX/SeedVR2_comfyUI,video-to-video,43816,52,"diffusers, gguf, art, video-to-video, base_model:ByteDance-Seed/SeedVR2-3B, base_model:quantized:ByteDance-Seed/SeedVR2-3B, license:apache-2.0, region:us","This repository contains additional upscale models for SeedVR2 video upscaling, complementing the main [numz/SeedVR2_comfyUI](https://huggingface.co/numz/SeedVR2_comfyUI) repository."
mlx-community/gemma-4-e4b-it-8bit,any-to-any,41246,14,"mlx, safetensors, gemma4, any-to-any, license:apache-2.0, 8-bit, region:us",This model was converted to MLX format from [`google/gemma-4-e4b-it`](https://huggingface.co/google/gemma-4-e4b-it)
hiddenlayerr/champion-edge-rf-model,tabular-classification,3,0,"transformers, joblib, tabular-classification, endpoints_compatible, region:us",
teohyc/Covid-XRay-Diffusion-Model,unconditional-image-generation,61,0,"diffusers, safetensors, Lung, Pneumonia, Covid-19, PyTorch, unconditional-image-generation, en",This is a diffusion model designed for generating synthetic COVID-19 X-ray images. The model takes random noise as input and iteratively denoises it to produce realistic X-ray images.
cyankiwi/gemma-4-31B-it-AWQ-4bit,image-text-to-text,322762,27,"transformers, safetensors, gemma4, image-text-to-text, conversational, base_model:google/gemma-4-31B-it, base_model:quantized:google/gemma-4-31B-it, license:apache-2.0","Gemma is a family of open models built by Google DeepMind. Gemma 4 models are multimodal, handling text and image input (with audio supported on small models) and generating text output. This release "
timm/ViT-B-32-SigLIP2-256,zero-shot-image-classification,11333,1,"open_clip, safetensors, siglip, siglip2, vision, zero-shot-image-classification, dataset:webli, arxiv:2502.14786",A SigLIP 2 Vision-Lanuage model trained on WebLI.
Tavernari/git-commit-message,summarization,677,23,"transformers, gguf, qwen2, git, commit, message, summarization, dataset:Tavernari/git-commit-message-dt","Welcome to the **Git Commit Message Generator**—an AI-powered tool that turns your code diffs into clear, meaningful commit messages with detailed reasoning. Hosted on Hugging Face, this reasoning ver"
keremberke/yolov8m-table-extraction,object-detection,9249,44,"ultralytics, tensorboard, v8, ultralyticsplus, yolov8, yolo, vision, object-detection",- Install [ultralyticsplus](https://github.com/fcakyon/ultralyticsplus):
polymathic-ai/aion-base,any-to-any,13078,19,"aion, safetensors, model_hub_mixin, pytorch_model_hub_mixin, any-to-any, dataset:MultimodalUniverse/legacysurvey, dataset:MultimodalUniverse/hsc, dataset:MultimodalUniverse/gaia","**AION-base** is a 300M parameter large omnimodal model specifically designed for astronomical surveys, presented in the paper [AION-1: Omnimodal Foundation Model for Astronomical Sciences](https://hu"
microsoft/trocr-large-handwritten,image-to-text,286018,158,"transformers, pytorch, vision-encoder-decoder, image-text-to-text, trocr, image-to-text, arxiv:2109.10282, endpoints_compatible",TrOCR model fine-tuned on the [IAM dataset](https://fki.tic.heia-fr.ch/databases/iam-handwriting-database). It was introduced in the paper [TrOCR: Transformer-based Optical Character Recognition with 
meta-llama/Llama-4-Scout-17B-16E-Instruct,image-text-to-text,364823,1266,"transformers, safetensors, llama4, image-text-to-text, facebook, meta, pytorch, llama",
Video-R1/Qwen2.5-VL-7B-COT-SFT,video-text-to-text,264,2,"transformers, safetensors, qwen2_5_vl, image-text-to-text, video-text-to-text, en, dataset:Video-R1/Video-R1-data, arxiv:2503.21776","This repository contains `Video-R1/Qwen2.5-VL-7B-COT-SFT`, the SFT (Supervised Fine-Tuning) cold start model trained using the Video-R1-COT-165k dataset. This intermediate checkpoint serves as the bas"
HPAI-BSC/Llama3.1-Aloe-Beta-8B,question-answering,1384,19,"transformers, safetensors, llama, text-generation, biology, medical, healthcare, question-answering",Aloe: A Family of Fine-tuned Open Healthcare LLMs
jinaai/jina-reranker-m0,text-classification,137256,118,"transformers, safetensors, qwen2_vl, feature-extraction, sentence-transformers, vidore, reranker, text-classification",[GGUF](https://huggingface.co/jinaai/jina-reranker-m0-GGUF)| [Blog](https://jina.ai/news/jina-reranker-m0-multilingual-multimodal-document-reranker) | [API](https://jina.ai/reranker) | [AWS](https://a
dslim/bert-large-NER,token-classification,121094,162,"transformers, pytorch, tf, jax, onnx, safetensors, bert, token-classification","If my open source models have been useful to you, please consider supporting me in building small, useful AI models for everyone (and help me afford med school / help out my parents financially). Than"
MidnightRunner/Ultralytics,object-detection,1505,5,"ultralytics, pytorch, yolo, yolov8, yolov11, object-detection, en, dataset:wider_face",**ComfyUI Ultralytics Integration – Midnight1111 Model Collection**
facebook/dpt-dinov2-giant-nyu,depth-estimation,60,1,"transformers, pytorch, safetensors, dpt, depth-estimation, vision, dinov2, arxiv:2304.07193",DPT (Dense Prediction Transformer) model with DINOv2 backbone as proposed in [DINOv2: Learning Robust Visual Features without Supervision](https://arxiv.org/abs/2304.07193) by Oquab et al.
speechbrain/emotion-recognition-wav2vec2-IEMOCAP,audio-classification,518876,184,"speechbrain, audio-classification, Emotion, Recognition, wav2vec2, pytorch, en, dataset:iemocap",This repository provides all the necessary tools to perform emotion recognition with a fine-tuned wav2vec2 (base) model using SpeechBrain.
