id,task,downloads,likes,tags,description
ostris/zimage_turbo_training_adapter,text-to-image,49241,132,"diffusers, text-to-image, lora, template:diffusion-lora, base_model:Tongyi-MAI/Z-Image-Turbo, base_model:adapter:Tongyi-MAI/Z-Image-Turbo, license:apache-2.0, region:us",This is a training adapter designed to be used for fine-tuning [Tongyi-MAI/Z-Image-Turbo](https://huggingface.co/Tongyi-MAI/Z-Image-Turbo).
OpenGVLab/VideoMAEv2-giant,video-classification,584,5,"safetensors, VideoMAEv2_Base, vision, video-classification, custom_code, arxiv:2203.12602, arxiv:2303.16727, license:cc-by-nc-4.0",VideoMAEv2-giant model pre-trained for 1200 epochs in a self-supervised way on UnlabeldHybrid-1M dataset. It was introduced in the paper [[CVPR23]VideoMAE V2: Scaling Video Masked Autoencoders with Du
gokulkarthik/xlm-roberta-qa-chaii,question-answering,2079,0,"transformers, pytorch, xlm-roberta, question-answering, en, ta, hi, dataset:squad","pre-trained XLM-Roberta with intermediate pre-training on SQUAD dataset (English) and fine tuning on Chaii dataset (Tamil, Hindi)"
gudaochangsheng/RefAlign-1.3B,image-text-to-video,0,0,"image-text-to-video, dataset:BestWishYsh/OpenS2V-5M, dataset:ZhuoweiChen/Phantom-data-Koala36M, arxiv:2603.25743, base_model:Wan-AI/Wan2.1-T2V-1.3B, base_model:finetune:Wan-AI/Wan2.1-T2V-1.3B, license:mit, region:us",&dagger;Corresponding authors *Interns in Baidu Inc. &ddagger;Equal Contribution
leejet/Z-Image-Turbo-GGUF,text-to-image,24527,37,"gguf, text-to-image, image-generation, stable-diffusion.cpp, z-image-turbo, z-image, en, zh",The license of the quantized files follows the license of the original model:
QiWang98/VideoRFT,video-text-to-text,200,5,"transformers, safetensors, qwen2_5_vl, image-text-to-text, video-text-to-text, en, dataset:QiWang98/VideoRFT-Data, arxiv:2505.12434","This repository contains the `VideoRFT` model, presented in the paper [VideoRFT: Incentivizing Video Reasoning Capability in MLLMs via Reinforced Fine-Tuning](https://huggingface.co/papers/2505.12434)"
wangdy/autotrain-godaddy2-38507101578,tabular-regression,1,0,"transformers, joblib, knn, autotrain, tabular, regression, tabular-regression, dataset:wangdy/autotrain-data-godaddy2",- Problem type: Single Column Regression
facebook/mbart-large-cc25,translation,11112,69,"transformers, pytorch, tf, mbart, text2text-generation, translation, en, ar",Pretrained (not finetuned) multilingual mbart model.
timm/convnext_small.in12k_ft_in1k,image-classification,49019,0,"timm, pytorch, safetensors, image-classification, transformers, dataset:imagenet-1k, dataset:imagenet-12k, arxiv:2201.03545",A ConvNeXt image classification model. Pretrained in `timm` on ImageNet-12k (a 11821 class subset of full ImageNet-22k) and fine-tuned on ImageNet-1k by Ross Wightman.
Qwen/Qwen3.5-35B-A3B-FP8,image-text-to-text,1867601,146,"transformers, safetensors, qwen3_5_moe, image-text-to-text, conversational, base_model:Qwen/Qwen3.5-35B-A3B, base_model:quantized:Qwen/Qwen3.5-35B-A3B, license:apache-2.0",> This repository contains FP8-quantized model weights and configuration files for the post-trained model in the Hugging Face Transformers format.
alexeisenach/SD3.5-Med-LoRA-Lineart,image-text-to-image,0,0,"image-text-to-image, en, base_model:stabilityai/stable-diffusion-3.5-medium, base_model:finetune:stabilityai/stable-diffusion-3.5-medium, region:us",
nvidia/NV-Generate-MR-Brain,unconditional-image-generation,334,16,"latent_diffusion, medical-imaging, diffusion, unconditional-image-generation, dataset:Forithmus/MR-RATE, arxiv:2508.05772, arxiv:2409.11169, license:other","NV-Generate-MR-Brain is a three-dimensional (3D) latent diffusion model designed to generate high-quality synthetic brain magnetic resonance imaging (MRI) images, achieving the highest resolution and "
Prior-Labs/tabpfn_2_6,tabular-classification,7860,14,"chemistry, biology, finance, legal, climate, medical, tabular-classification, license:other",TabPFN-2.6 is a transformer-based foundation model that uses in-context-learning to solve tabular prediction problems in a forward pass.
ductai199x/sam_hq_vit_huge,mask-generation,7,0,"transformers, safetensors, sam_hq, mask-generation, custom_code, arxiv:2306.01567, license:apache-2.0, endpoints_compatible",Directly converted weights from [https://github.com/SysCV/sam-hq/tree/main](https://github.com/SysCV/sam-hq/tree/main) to huggingface format.
llmrobot/qwen-image-layered-int8-sdnq,image-text-to-image,5,0,"diffusers, safetensors, quantized, qwen, image-text-to-image, en, zh, base_model:Qwen/Qwen-Image-Layered",8 bit (int8 with SVD rank 128) quantization of [Qwen/Qwen-Image-Layered](https://huggingface.co/Qwen/Qwen-Image-Layered) using [SDNQ](https://github.com/Disty0/sdnq).
bibekbehera/autotrain-numeric_prediction-40376105019,tabular-regression,9,0,"transformers, joblib, xgboost, autotrain, tabular, regression, tabular-regression, dataset:bibekbehera/autotrain-data-numeric_prediction",- Problem type: Single Column Regression
Qwen/Qwen3-0.6B,text-generation,15063024,1190,"transformers, safetensors, qwen3, text-generation, conversational, arxiv:2505.09388, base_model:Qwen/Qwen3-0.6B-Base, base_model:finetune:Qwen/Qwen3-0.6B-Base","Qwen3 is the latest generation of large language models in Qwen series, offering a comprehensive suite of dense and mixture-of-experts (MoE) models. Built upon extensive training, Qwen3 delivers groun"
BAAI/bge-small-zh-v1.5,feature-extraction,1793287,109,"transformers, pytorch, safetensors, bert, feature-extraction, zh, arxiv:2310.07554, arxiv:2309.07597",More details please refer to our Github: [FlagEmbedding](https://github.com/FlagOpen/FlagEmbedding).
SWivid/F5-TTS,text-to-speech,668808,1160,"f5-tts, text-to-speech, dataset:amphion/Emilia-Dataset, arxiv:2410.06885, license:cc-by-nc-4.0, region:us",Download [F5-TTS](https://huggingface.co/SWivid/F5-TTS/tree/main/F5TTS_Base) or [E2 TTS](https://huggingface.co/SWivid/E2-TTS/tree/main/E2TTS_Base) and place under ckpts/
image-matching-models/eloftr,keypoint-detection,82,0,"image-matching-models, image-matching, keypoint-detection, feature-matching, license:apache-2.0, region:us",For usage see https://github.com/gmberton/image-matching-models
Helsinki-NLP/opus-mt-zh-en,translation,206963,551,"transformers, pytorch, tf, rust, marian, text2text-generation, translation, zh",- [Model Details](#model-details)
iitolstykh/YOLO-Face-Person-Detector,object-detection,8179,15,"ultralytics, safetensors, yolov8, yolo, object-detection, computer-vision, face-detection, person-detection",This model is a fine-tuned version of **YOLOv8x** specialized in detecting two specific classes: **Face** and **Person**.
lighteternal/nli-xlm-r-greek,zero-shot-classification,18846,2,"transformers, pytorch, xlm-roberta, text-classification, xlm-roberta-base, zero-shot-classification, el, en",This model was trained using [SentenceTransformers](https://sbert.net) [Cross-Encoder](https://www.sbert.net/examples/applications/cross-encoder/README.html) class.
Dhineshk/TestDocumentQuestionAnswering,document-question-answering,6,0,"transformers, pytorch, layoutlmv2, document-question-answering, generated_from_trainer, base_model:microsoft/layoutlmv2-base-uncased, base_model:finetune:microsoft/layoutlmv2-base-uncased, license:cc-by-nc-sa-4.0","should probably proofread and complete it, then remove this comment. -->"
keras-io/tab_transformer,tabular-classification,8,43,"tf-keras, tensorboard, tabular-classification, transformer, region:us",This repo contains the trained model of [Structured data learning with TabTransformer](https://keras.io/examples/structured_data/tabtransformer/#define-dataset-metadata).
dzur658/mlx-unet-mnist,image-text-to-image,32,0,"mlx, image-text-to-image, license:mit, region:us",This is a toy model I made trained on the MNIST numbers dataset using MLX. It can draw the digits 0-9.
magespace/Wan2.2-I2V-A14B-Lightning-Diffusers,text-to-video,39198,2,"diffusers, safetensors, text-to-video, arxiv:2503.20314, arxiv:2309.14509, license:apache-2.0, diffusers:WanImageToVideoPipeline, region:us","💜 <a href=""https://wan.video""><b>Wan</b></a> &nbsp&nbsp ｜ &nbsp&nbsp 🖥️ <a href=""https://github.com/Wan-Video/Wan2.2"">GitHub</a> &nbsp&nbsp  | &nbsp&nbsp🤗 <a href=""https://huggingface.co/Wan-AI/"">Hugg"
facebook/sam2.1-hiera-tiny,mask-generation,26593,23,"transformers, safetensors, sam2_video, feature-extraction, mask-generation, arxiv:2408.00714, license:apache-2.0, endpoints_compatible","Repository for SAM 2: Segment Anything in Images and Videos, a foundation model towards solving promptable visual segmentation in images and videos from FAIR. See the [SAM 2 paper](https://arxiv.org/a"
Crosby117/Poison,image-text-to-video,0,0,"allennlp, agent, image-text-to-video, en, dataset:Roman1111111/claude-opus-4.6-10000x, arxiv:1910.09700, base_model:hakurei/Literature-7B-16384, base_model:finetune:hakurei/Literature-7B-16384",This modelcard aims to be a base template for new models. It has been generated using [this raw template](https://github.com/huggingface/huggingface_hub/blob/main/src/huggingface_hub/templates/modelca
iloncka/culico-net-segm-v1-nano,mask-generation,7,0,"sam2, mask-generation, segmentation, instance-segmentation, video-segmentation, dataset:iloncka/mosquito-species-segmentation-dataset, arxiv:2408.00714, base_model:facebook/sam2-hiera-tiny",Model Card for `culico-net-segm-v1-nano`
facebook/mms-tts-eng,text-to-speech,144837,175,"transformers, pytorch, safetensors, vits, text-to-audio, mms, text-to-speech, arxiv:2305.13516",This repository contains the **English (eng)** language text-to-speech (TTS) model checkpoint.
Jackrong/Qwen3.5-9B-Claude-4.6-Opus-Reasoning-Distilled-GGUF,image-text-to-image,578026,263,"gguf, qwen3_5, unsloth, qwen, qwen3.5, reasoning, chain-of-thought, lora","🔥 **Update (April 5):** I’ve released the complete training notebook, codebase, and a comprehensive PDF guide to help beginners and enthusiasts understand and reproduce this model's fine-tuning proces"
PORTULAN/serafim-335m-portuguese-pt-sentence-encoder-ir,sentence-similarity,277455,0,"sentence-transformers, safetensors, bert, feature-extraction, sentence-similarity, transformers, pt, arxiv:2407.19527",This is a [sentence-transformers](https://www.SBERT.net) model: It maps sentences & paragraphs to a 1024 dimensional dense vector space and can be used for tasks like clustering or semantic search.
chenjh007/image-model,image-text-to-image,0,0,"transformers, image-text-to-image, zh, base_model:black-forest-labs/FLUX.1-dev, base_model:finetune:black-forest-labs/FLUX.1-dev, license:apache-2.0, endpoints_compatible, region:us",
tiennvcs/layoutlmv2-large-uncased-finetuned-vi-infovqa,document-question-answering,9,0,"transformers, pytorch, tensorboard, layoutlmv2, document-question-answering, generated_from_trainer, license:cc-by-nc-sa-4.0, endpoints_compatible","should probably proofread and complete it, then remove this comment. -->"
tianweiy/DMD2,text-to-image,52544,235,"diffusers, text-to-image, stable-diffusion, diffusion distillation, arxiv:2405.14867, license:cc-by-nc-4.0, region:us","> [**Improved Distribution Matching Distillation for Fast Image Synthesis**](https://arxiv.org/abs/2405.14867),"
Video-R1/Video-R1-7B,video-text-to-text,732,15,"transformers, safetensors, qwen2_5_vl, image-text-to-text, video-text-to-text, en, dataset:Video-R1/Video-R1-data, arxiv:2503.21776",This repository contains the Video-R1-7B model as presented in [Video-R1: Reinforcing Video Reasoning in MLLMs](https://arxiv.org/pdf/2503.21776).
Qwen/Qwen3-4B-Thinking-2507,text-generation,1702160,578,"transformers, safetensors, qwen3, text-generation, conversational, arxiv:2505.09388, license:apache-2.0, eval-results","Over the past three months, we have continued to scale the **thinking capability** of Qwen3-4B, improving both the **quality and depth** of reasoning. We are pleased to introduce **Qwen3-4B-Thinking-2"
cavargas10/TRELLIS-text-xlarge,text-to-3d,70,0,"trellis, text-to-3d, en, arxiv:2412.01506, license:mit, region:us","The text conditioned version of TRELLIS with model size XL, a large 3D genetive model. It was introduced in the paper [Structured 3D Latents for Scalable and Versatile 3D Generation](https://huggingfa"
pnnbao-ump/VieNeu-TTS,text-to-speech,15899,68,"safetensors, qwen2, text-to-speech, vi, dataset:pnnbao-ump/VieNeu-TTS-1000h, dataset:pnnbao-ump/VieNeu-TTS-140h, base_model:neuphonic/neutts-air, base_model:finetune:neuphonic/neutts-air",**VieNeu-TTS** is an advanced on-device Vietnamese Text-to-Speech (TTS) model with **instant voice cloning**.
timm/vit_base_patch32_clip_224.laion400m_e31,zero-shot-image-classification,38029,0,"open_clip, safetensors, clip, zero-shot-image-classification, license:mit, region:us","This model is a dual use `open_clip` and `timm` model. Model name in OpenCLIP is `ViT-B-32-quickgelu`, and timm name is `vit_base_patch32_clip_224.laion400m_e31`."
MHRDYN7/videoprism-base-f16r288-finetuned-ucf101,video-classification,100,0,"transformers, safetensors, videoprism_vision_model, video-classification, dataset:sayakpaul/ucf101-subset, arxiv:1910.09700, endpoints_compatible, region:us",This is the model card of a 🤗 transformers model that has been pushed on the Hub. This model card has been automatically generated.
Cosmicvibez/LTX-2.3,image-to-video,3829,1,"diffusers, image-to-video, text-to-video, video-to-video, image-text-to-video, audio-to-video, text-to-audio, video-to-audio","This model card focuses on the LTX-2.3 model, which is a significant update to the [LTX-2 model](https://huggingface.co/Lightricks/LTX-2) with improved audio and visual quality as well as enhanced pro"
microsoft/dit-base-finetuned-rvlcdip,image-classification,70945,37,"transformers, pytorch, beit, image-classification, dit, vision, dataset:rvl_cdip, arxiv:2203.02378","Document Image Transformer (DiT) model pre-trained on IIT-CDIP (Lewis et al., 2006), a dataset that includes 42 million document images and fine-tuned on [RVL-CDIP](https://www.cs.cmu.edu/~aharley/rvl"
pnnbao-ump/VieNeu-TTS-v2-Turbo-GGUF,text-to-speech,17777,3,"gguf, tts, vietnamese, bilingual, onnx, cpu-inference, code-switching, on-device","> **Ultra-fast Vietnamese & English TTS — runs entirely on CPU, no GPU required.**"
jetx/trellis-image-large,image-to-3d,17762,8,"trellis, image-to-3d, en, arxiv:2412.01506, license:mit, region:us","The image conditioned version of TRELLIS, a large 3D genetive model. It was introduced in the paper [Structured 3D Latents for Scalable and Versatile 3D Generation](https://huggingface.co/papers/2412."
google-t5/t5-large,translation,526817,256,"transformers, pytorch, tf, jax, safetensors, t5, text2text-generation, summarization",1. [Model Details](#model-details)
OpenMed/OpenMed-NER-GenomeDetect-SuperClinical-434M,token-classification,90994,5,"transformers, safetensors, deberta-v2, token-classification, named-entity-recognition, biomedical-nlp, gene-recognition, protein-recognition",**Specialized model for Gene/Protein Entity Recognition - Gene and protein mentions**
ali-vilab/text-to-video-ms-1.7b,text-to-video,21304,656,"diffusers, safetensors, text-to-video, arxiv:2308.06571, license:cc-by-nc-4.0, diffusers:TextToVideoSDPipeline, region:us","This model is based on a multi-stage text-to-video generation diffusion model, which inputs a description text and returns a video that matches the text description. Only English input is supported."
google/tapas-base-finetuned-sqa,table-question-answering,1403,7,"transformers, pytorch, tf, tapas, table-question-answering, en, dataset:msr_sqa, arxiv:2004.02349",This model has 2 versions which can be used. The default version corresponds to the `tapas_sqa_inter_masklm_base_reset` checkpoint of the [original Github repository](https://github.com/google-researc
IMISLab/GreekWiki-umt5-base,summarization,6338,1,"safetensors, umt5, summarization, el, license:apache-2.0, model-index, region:us",A Greek encyclopedic article summarization model trained and evaluated on [GreekWikipedia](https://huggingface.co/datasets/IMISLab/GreekWikipedia/).
lmstudio-community/gemma-4-E2B-it-MLX-4bit,any-to-any,2372,0,"transformers, safetensors, gemma4, image-text-to-text, mlx, any-to-any, base_model:google/gemma-4-E2B-it, base_model:quantized:google/gemma-4-E2B-it",_👾 [LM Studio](https://lmstudio.ai) Community models highlights program. Highlighting new & noteworthy models by the community. Join the conversation on [Discord](https://discord.gg/aPQfnNkxGC)_.
jzsues/llava-qwen1.5-4b-chat,visual-question-answering,194,0,"transformers, safetensors, llava-qwen2, text-generation, visual-question-answering, zh, en, dataset:Lin-Chen/ShareGPT4V",llava-qwen1.5-4b-chat is a lightweight multimodal models base on [LLaVA architecture](https://llava-vl.github.io/).
OpenMed/OpenMed-NER-SpeciesDetect-ModernMed-149M,token-classification,109723,0,"transformers, safetensors, modernbert, token-classification, named-entity-recognition, biomedical-nlp, species-recognition, taxonomy",**Specialized model for Species Entity Recognition - Species and organism names**
HiDolen/Mini-BS-RoFormer-V2-46.8M,audio-to-audio,213,4,"transformers, safetensors, bs_roformer, feature-extraction, music, audio-to-audio, custom_code, dataset:CLAPv2/MUSDB18-HQ",Model for the Music source separation task.
meituan-longcat/LongCat-Image-Edit,image-to-image,23518,169,"transformers, diffusers, safetensors, image-to-image, en, zh, arxiv:2512.07584, license:apache-2.0",[//]: # (  <a href='https://meituan-longcat.github.io/LongCat-Image/'><img src='https://img.shields.io/badge/Project-Page-green'></a>)
microsoft/mpnet-base,fill-mask,132678,50,"transformers, pytorch, tf, safetensors, mpnet, fill-mask, endpoints_compatible, region:us",
prabinpanta0/celsius-to-fahrenheit,tabular-regression,17,3,"tf-keras, temperature-conversion, celsius-to-fahrenheit, tensorflow, neural-network, tabular-regression, en, dataset:prabinpanta0/celsius-to-fahrenheit",This model is a simple neural network that converts temperatures from Celsius to Fahrenheit.
vismatch/xfeat,keypoint-detection,584,0,"vismatch, image-matching, keypoint-detection, feature-matching, license:apache-2.0, region:us",For usage see https://github.com/gmberton/vismatch
deepvk/GeRaCl-USER2-base,zero-shot-classification,1242,18,"safetensors, GeRaCl, zero-shot-classification, ru, dataset:deepvk/GeRaCl_synthethic_dataset, base_model:deepvk/USER2-base, base_model:finetune:deepvk/USER2-base, license:apache-2.0",**GeRaCl** is a **Ge**neral **Ra**pid **Cl**assifer designed to perform zero-shot classification tasks primarily on Russian texts.
google/pegasus-billsum,summarization,245,4,"transformers, pytorch, pegasus, text2text-generation, summarization, en, arxiv:1912.08777, endpoints_compatible",See Docs: [here](https://huggingface.co/transformers/master/model_doc/pegasus.html)
Qwen/Qwen3-32B,text-generation,2394515,681,"transformers, safetensors, qwen3, text-generation, conversational, arxiv:2309.00071, arxiv:2505.09388, license:apache-2.0","Qwen3 is the latest generation of large language models in Qwen series, offering a comprehensive suite of dense and mixture-of-experts (MoE) models. Built upon extensive training, Qwen3 delivers groun"
CAIR-HKISI/SurgMotion-vitl,video-classification,77,4,"pytorch, surgmotion, surgical-video, foundation-model, video-understanding, phase-recognition, v-jepa, vision-transformer","SurgMotion-L is the ViT-Large checkpoint of SurgMotion, a video-native foundation model for universal understanding of surgical videos."
facehain/LTX2-Rapid-Merges,image-text-to-video,0,0,"ltx2, t2v, i2v, image-text-to-video, base_model:Lightricks/LTX-2, base_model:finetune:Lightricks/LTX-2, license:other, region:us","**I'm winding down maintaining these models. I recommend checking out the [merging script](https://huggingface.co/Phr00t/LTX2-Rapid-Merges/blob/main/MergingScript/fancy-apply.py) to create your own, a"
Helsinki-NLP/opus-mt-en-uk,translation,9625,16,"transformers, pytorch, tf, marian, text2text-generation, translation, en, uk",*  OPUS readme: [en-uk](https://github.com/Helsinki-NLP/OPUS-MT-train/blob/master/models/en-uk/README.md)
PaddlePaddle/th_PP-OCRv5_mobile_rec,image-to-text,1608,2,"PaddleOCR, OCR, PaddlePaddle, textline_recognition, image-to-text, en, license:apache-2.0, region:us",th_PP-OCRv5_mobile_rec is one of the PP-OCRv5_rec that are the latest generation text line recognition models developed by PaddleOCR team. It aims to efficiently and accurately support the recognition
Joy28/videomae-base-finetuned-subset-200epochs,video-classification,73,0,"transformers, safetensors, videomae, video-classification, generated_from_trainer, base_model:MCG-NJU/videomae-base, base_model:finetune:MCG-NJU/videomae-base, license:cc-by-nc-4.0","should probably proofread and complete it, then remove this comment. -->"
unitary/toxic-bert,text-classification,290187,220,"transformers, pytorch, jax, safetensors, bert, text-classification, arxiv:1703.04009, arxiv:1905.12516",The huggingface models currently give different results to the detoxify library (see issue [here](https://github.com/unitaryai/detoxify/issues/15)). For the most up to date models we recommend using t
laion/CLIP-ViT-H-14-laion2B-s32B-b79K,zero-shot-image-classification,399870,452,"open_clip, pytorch, safetensors, clip, zero-shot-image-classification, arxiv:1910.04867, license:mit, region:us",1. [Model Details](#model-details)
apple/MobileCLIP-S2-OpenCLIP,zero-shot-image-classification,64306,19,"open_clip, safetensors, clip, zero-shot-image-classification, arxiv:2311.17049, arxiv:2103.00020, arxiv:2303.15343, arxiv:2309.17425",MobileCLIP was introduced in [MobileCLIP: Fast Image-Text Models through Multi-Modal Reinforced Training
lllyasviel/control_v11p_sd15_openpose,image-to-image,16238,135,"diffusers, safetensors, art, controlnet, stable-diffusion, controlnet-v1-1, image-to-image, arxiv:2302.05543",**Controlnet v1.1** is the successor model of [Controlnet v1.0](https://huggingface.co/lllyasviel/ControlNet)
srg/outhimar_64-Close-regression,tabular-regression,0,4,"sklearn, tabular-regression, baseline-trainer, license:apache-2.0, region:us",r2                        0.999858
bartowski/LLaMA-Mesh-GGUF,text-to-3d,1291,36,"gguf, mesh-generation, text-to-3d, base_model:Zhengyi/LLaMA-Mesh, base_model:quantized:Zhengyi/LLaMA-Mesh, license:llama3.1, endpoints_compatible, region:us","Using <a href=""https://github.com/ggerganov/llama.cpp/"">llama.cpp</a> release <a href=""https://github.com/ggerganov/llama.cpp/releases/tag/b4132"">b4132</a> for quantization."
tlennon-ie/qwen-edit-skin,image-to-image,14187,178,"diffusers, lora, template:diffusion-lora, image-to-image, qwen, en, base_model:Qwen/Qwen-Image-Edit-2509, base_model:adapter:Qwen/Qwen-Image-Edit-2509","EDIT- Version 1.1 uploaded with better convergence, less artifacts and more room in strengths to play with. See [""Full comparision"" examples in the image folder here](https://huggingface.co/tlennon-ie"
LiheYoung/depth_anything_vits14,depth-estimation,3266,9,"transformers, pytorch, depth_anything, depth-estimation, arxiv:2401.10891, endpoints_compatible, region:us",The model card for our paper [Depth Anything: Unleashing the Power of Large-Scale Unlabeled Data](https://arxiv.org/abs/2401.10891).
tiantiaf/whisper-large-v3-broad-accent,audio-classification,3970,0,"safetensors, model_hub_mixin, pytorch_model_hub_mixin, audio-classification, en, dataset:mozilla-foundation/common_voice_11_0, arxiv:2505.14648, base_model:openai/whisper-large-v3",This model includes the implementation of broader accent classification described in Vox-Profile: A Speech Foundation Model Benchmark for Characterizing Diverse Speaker and Speech Traits (https://arxi
Aisha-AI-Official/wan2.2-rough-sex-sidefuck,image-text-to-video,0,5,"lora, nsfw, image-text-to-video, base_model:Wan-AI/Wan2.2-I2V-A14B-Diffusers, base_model:adapter:Wan-AI/Wan2.2-I2V-A14B-Diffusers, region:us",The scene starts with the woman posing.
rizki-syazali/tapasid_finetuned_sqa_to_itqa,table-question-answering,2,0,"transformers, safetensors, tapas, table-question-answering, arxiv:1910.09700, endpoints_compatible, region:us",This is the model card of a 🤗 transformers model that has been pushed on the Hub. This model card has been automatically generated.
Zyphra/Zonos-v0.1-transformer,text-to-speech,10309,422,"zonos, safetensors, text-to-speech, license:apache-2.0, region:us","Zonos-v0.1 is a leading open-weight text-to-speech model trained on more than 200k hours of varied multilingual speech, delivering expressiveness and quality on par with—or even surpassing—top TTS pro"
MoritzLaurer/DeBERTa-v3-base-mnli,zero-shot-classification,3373,8,"transformers, pytorch, safetensors, deberta-v2, text-classification, zero-shot-classification, en, arxiv:2006.03654","This model was trained on the MultiNLI dataset, which consists of 392 702 NLI hypothesis-premise pairs."
google/pegasus-cnn_dailymail,summarization,10995,110,"transformers, pytorch, rust, pegasus, text2text-generation, summarization, en, arxiv:1912.08777",See Docs: [here](https://huggingface.co/transformers/master/model_doc/pegasus.html)
hotchpotch/open-provence-reranker-xsmall-v1,text-ranking,116504,1,"safetensors, open_provence, text-ranking, custom_code, en, ja, dataset:hotchpotch/msmarco-context-relevance, dataset:hotchpotch/japanese-context-relevance",> ⚡️ Lightweight Provence-style rerankers that keep the answers and drop the noise for retrieval-augmented generation.
laion/CLIP-convnext_base_w-laion2B-s13B-b82K-augreg,zero-shot-image-classification,707578,7,"open_clip, tensorboard, safetensors, clip, zero-shot-image-classification, arxiv:2201.03545, arxiv:1910.04867, license:mit",1. [Model Details](#model-details)
